{
  "costs": [
    {
      "break_even_bps": 8328,
      "demand_service_ns": 681000,
      "displacement_refill_ns": 965000,
      "h2d_bytes": 208896,
      "lead_ns": 1352685,
      "predictor_compute_ns": 1815,
      "readiness": "DEVICE_READY",
      "scheduler_demand_delay_ns": 54136,
      "speculative_service_ns": 2361000,
      "storage_bytes": 208896,
      "transport": "BUFFERED",
      "utility_min_observations": 32,
      "utility_min_timely_successes": 54,
      "utility_window_predictions": 64
    },
    {
      "break_even_bps": 9999,
      "demand_service_ns": 2000,
      "displacement_refill_ns": 182000,
      "h2d_bytes": 0,
      "lead_ns": 1352685,
      "predictor_compute_ns": 1815,
      "readiness": "HOST_READY",
      "scheduler_demand_delay_ns": 54136,
      "speculative_service_ns": 722000,
      "storage_bytes": 208896,
      "transport": "BUFFERED",
      "utility_min_observations": 32,
      "utility_min_timely_successes": 64,
      "utility_window_predictions": 64
    },
    {
      "break_even_bps": 7945,
      "demand_service_ns": 52000,
      "displacement_refill_ns": 68000,
      "h2d_bytes": 208896,
      "lead_ns": 1352685,
      "predictor_compute_ns": 1815,
      "readiness": "DEVICE_READY",
      "scheduler_demand_delay_ns": 54136,
      "speculative_service_ns": 70000,
      "storage_bytes": 0,
      "transport": "HOST_TO_DEVICE",
      "utility_min_observations": 32,
      "utility_min_timely_successes": 51,
      "utility_window_predictions": 64
    }
  ],
  "measurements": [
    {
      "name": "mxfp4-split-buffered-break-even.json",
      "nested_head": "31da300472a435fdcfeb3fa155edb6dad6ce4c53",
      "profile_sha256": "dad723a5c2b66c2d78d052c60cc327455d30049a88b595ab0c0b0722a357d1f9",
      "project_head": "032b13c57e99adbd3eef58401740660355b7502d",
      "sha256": "3802b3a1dd0f07520eb63bcb2391da66d1961dbec90766353a3b1a1c9f75a841",
      "size": 10951,
      "storage_map_sha256": "16c7c2135edf93fa385b728c7c73d0d4ebb315a75e254c8f18ff9f50b2e815b7"
    }
  ],
  "schema_version": "phase10-target-costs-v1",
  "status": "pass",
  "target": {
    "expert_bytes_sha256": "d3fc1c04eee06cd0c184dc82cc1721517cca16e8ab0510f85ad7e737cf156860",
    "files": [
      {
        "name": "Kimi-K3-0.40B-MXFP4-00001-of-00218.gguf",
        "ordinal": 0,
        "sha256": "cdf32bde31a26b4b1f38a4328f1580ab86d4befbe6c791b1a780ac6f760bc5f9",
        "size": 7465760
      },
      {
        "name": "Kimi-K3-0.40B-MXFP4-00002-of-00218.gguf",
        "ordinal": 1,
        "sha256": "45bcb408b7c78b9c5e77385b0dc8ec4b0aea8e0c06ac8caf8a310928b508b362",
        "size": 557248
      },
      {
        "name": "Kimi-K3-0.40B-MXFP4-00003-of-00218.gguf",
        "ordinal": 2,
        "sha256": "1e474a1b25c67126025b63acb1f81e1d34cd378d24dd8617953f37c05b3bc7d7",
        "size": 557248
      },
      {
        "name": "Kimi-K3-0.40B-MXFP4-00004-of-00218.gguf",
        "ordinal": 3,
        "sha256": "9e6b78c7739d2555ff309494f3fea2e7a74c1badda44fc759840b5c788421ef6",
        "size": 557248
      },
      {
        "name": "Kimi-K3-0.40B-MXFP4-00005-of-00218.gguf",
        "ordinal": 4,
        "sha256": "25140655a70997d9dc41a886c248810be83379057ff2bc9bd1f95807ec225c31",
        "size": 557248
      },
      {
        "name": "Kimi-K3-0.40B-MXFP4-00006-of-00218.gguf",
        "ordinal": 5,
        "sha256": "d37cae6bc7565f05ceb4a4e87b588b66477b9d08abe41ef13790e9bf1f281463",
        "size": 557248
      },
      {
        "name": "Kimi-K3-0.40B-MXFP4-00007-of-00218.gguf",
        "ordinal": 6,
        "sha256": "ab55b3f3151ddf25a933781da1d43083d6f44c514a89d8a86ae6d30c48841775",
        "size": 557248
      },
      {
        "name": "Kimi-K3-0.40B-MXFP4-00008-of-00218.gguf",
        "ordinal": 7,
        "sha256": "75dd476d4a773dc8ed9116a2f300377d8fc6c76017ce737679c21cf6b7eb3c43",
        "size": 557248
      },
      {
        "name": "Kimi-K3-0.40B-MXFP4-00009-of-00218.gguf",
        "ordinal": 8,
        "sha256": "0a8d306b94987a8b696ed2046a55f4d4cdd5cad2cd9f91add656d97c91c5c0ba",
        "size": 557248
      },
      {
        "name": "Kimi-K3-0.40B-MXFP4-00010-of-00218.gguf",
        "ordinal": 9,
        "sha256": "4f422c1e3dd0a26fd38fb40699236ce88ee555968247bf656c65e1573cca7a76",
        "size": 557248
      },
      {
        "name": "Kimi-K3-0.40B-MXFP4-00011-of-00218.gguf",
        "ordinal": 10,
        "sha256": "28f215e96b628453c96147e2bae89a1c6a182895a04da9fe58346894047ab359",
        "size": 557248
      },
      {
        "name": "Kimi-K3-0.40B-MXFP4-00012-of-00218.gguf",
        "ordinal": 11,
        "sha256": "f759f273051210b963b1492d1fef29f8d6b96ecc2f2f41b27de5f00b7106cd72",
        "size": 557248
      },
      {
        "name": "Kimi-K3-0.40B-MXFP4-00013-of-00218.gguf",
        "ordinal": 12,
        "sha256": "16f961ba197c029b81d6d71da9bcc4685f2796c6006528333f4450da424a87d2",
        "size": 557248
      },
      {
        "name": "Kimi-K3-0.40B-MXFP4-00014-of-00218.gguf",
        "ordinal": 13,
        "sha256": "695218c674774775bcdac8375ae3d0379f47d869fc696273fc3dbb64b9b7015f",
        "size": 557248
      },
      {
        "name": "Kimi-K3-0.40B-MXFP4-00015-of-00218.gguf",
        "ordinal": 14,
        "sha256": "b2a148718d4c0881a4393874d2e69bb25fcd3761f13d989bee957392be7fc1cd",
        "size": 557248
      },
      {
        "name": "Kimi-K3-0.40B-MXFP4-00016-of-00218.gguf",
        "ordinal": 15,
        "sha256": "3835f989a092b3005bfa71a0689526f80de51ebab426051b9ae4b239bd467f55",
        "size": 557248
      },
      {
        "name": "Kimi-K3-0.40B-MXFP4-00017-of-00218.gguf",
        "ordinal": 16,
        "sha256": "f6785700ff117f2ab248999fcec7b84ab8cef53d8467b4ed49aaa8300bedcbd7",
        "size": 557248
      },
      {
        "name": "Kimi-K3-0.40B-MXFP4-00018-of-00218.gguf",
        "ordinal": 17,
        "sha256": "95e576926a7f1046903efbc5e8d18105bc7990d10019981a62eb434d84c4c7b9",
        "size": 557248
      },
      {
        "name": "Kimi-K3-0.40B-MXFP4-00019-of-00218.gguf",
        "ordinal": 18,
        "sha256": "5fecc0e1b9a5f118ccf9be5e81408ebe6bb7caf8eb6c9458fc8654f1da83ad97",
        "size": 557248
      },
      {
        "name": "Kimi-K3-0.40B-MXFP4-00020-of-00218.gguf",
        "ordinal": 19,
        "sha256": "32ebd7c9f203ba7a930adb08e552eec484a4e18242800ccfe529b461c9d39f1a",
        "size": 557248
      },
      {
        "name": "Kimi-K3-0.40B-MXFP4-00021-of-00218.gguf",
        "ordinal": 20,
        "sha256": "42ec7ca0ed60e76a0041312f6e2dd6bf5341292f3f4af235e06507d088de0ab9",
        "size": 557248
      },
      {
        "name": "Kimi-K3-0.40B-MXFP4-00022-of-00218.gguf",
        "ordinal": 21,
        "sha256": "6bc16d19714ce88bb3c1c62f82c90b05a34d8505a4fdfc994b003061a0ed2759",
        "size": 335544480
      },
      {
        "name": "Kimi-K3-0.40B-MXFP4-00023-of-00218.gguf",
        "ordinal": 22,
        "sha256": "9b7ad873efd263ecf80814e9931a76c5fd5857b21627472bb242fbafff514f4d",
        "size": 335544512
      },
      {
        "name": "Kimi-K3-0.40B-MXFP4-00024-of-00218.gguf",
        "ordinal": 23,
        "sha256": "0f9d6f86df3be63a9965a5b473fff854988cea0adff2d5aa2b9cac310f591a01",
        "size": 4256
      },
      {
        "name": "Kimi-K3-0.40B-MXFP4-00025-of-00218.gguf",
        "ordinal": 24,
        "sha256": "5e1873ffdfa763422d081a61767b23fff054f03c6996343e6443ca983e07d054",
        "size": 4194496
      },
      {
        "name": "Kimi-K3-0.40B-MXFP4-00026-of-00218.gguf",
        "ordinal": 25,
        "sha256": "6b30fc9c9469e871a6455ac8e4b08fb06213bea53de829482dda01b4f3f625bf",
        "size": 4194496
      },
      {
        "name": "Kimi-K3-0.40B-MXFP4-00027-of-00218.gguf",
        "ordinal": 26,
        "sha256": "031aff7dc83c820f866cfa1b4fcffa1d1be2e5558213493a6ac3545671cf2c28",
        "size": 4194496
      },
      {
        "name": "Kimi-K3-0.40B-MXFP4-00028-of-00218.gguf",
        "ordinal": 27,
        "sha256": "be0914bb214bdf22a5253ca60a6ff5b2af0746319fecd143e751964ef06a32f9",
        "size": 4288
      },
      {
        "name": "Kimi-K3-0.40B-MXFP4-00029-of-00218.gguf",
        "ordinal": 28,
        "sha256": "7b60ac2a90f31bcde910ec3ad1a05bb13f63e8c250957de2c9a541e6c69a9629",
        "size": 4256
      },
      {
        "name": "Kimi-K3-0.40B-MXFP4-00030-of-00218.gguf",
        "ordinal": 29,
        "sha256": "498e69896dd60aed69772287afe4a07cf6ae91e7ebfbe6c23ad4101032391a99",
        "size": 4288
      },
      {
        "name": "Kimi-K3-0.40B-MXFP4-00031-of-00218.gguf",
        "ordinal": 30,
        "sha256": "821388304d2bb03597e92e3b4908a62a1d4dd06cca0762898c1588184eb8ee5d",
        "size": 192
      },
      {
        "name": "Kimi-K3-0.40B-MXFP4-00032-of-00218.gguf",
        "ordinal": 31,
        "sha256": "7b4dd5a6f0d5e82afd78f151f9ffdea902e7f2896c4868ded24f7b15cc4280d2",
        "size": 16576
      },
      {
        "name": "Kimi-K3-0.40B-MXFP4-00033-of-00218.gguf",
        "ordinal": 32,
        "sha256": "152d27f3e3ce388bcc82bd2f1095d99dbe9867dabb1972993103c6b4b9eb3631",
        "size": 1184
      },
      {
        "name": "Kimi-K3-0.40B-MXFP4-00034-of-00218.gguf",
        "ordinal": 33,
        "sha256": "1e6a7d27e590970d4019e2598c227f01184ffc1a5f036072db02fbaf159e6ce9",
        "size": 65728
      },
      {
        "name": "Kimi-K3-0.40B-MXFP4-00035-of-00218.gguf",
        "ordinal": 34,
        "sha256": "d4251d93eadae1dc8cdde3de86b23a2ab4ab4dbdefcebf2ae5121805580a1cb1",
        "size": 16576
      },
      {
        "name": "Kimi-K3-0.40B-MXFP4-00036-of-00218.gguf",
        "ordinal": 35,
        "sha256": "7d46e2e0a49661738db2b20ef9202620632f67521814c5822b9e3bd22846ebb0",
        "size": 524480
      },
      {
        "name": "Kimi-K3-0.40B-MXFP4-00037-of-00218.gguf",
        "ordinal": 36,
        "sha256": "459aa8c46d2ad47269996a4560b5c8e5bfa93ab111c88916d522ff1f636834a2",
        "size": 4288
      },
      {
        "name": "Kimi-K3-0.40B-MXFP4-00038-of-00218.gguf",
        "ordinal": 37,